<?xml version="1.0" encoding="UTF-8"?>
<xs:schema attributeFormDefault="unqualified" elementFormDefault="qualified" xmlns:xs="http://www.w3.org/2001/XMLSchema">
    <xs:element name="user" type="userType"/>
    <xs:complexType name="sourceType">
        <xs:simpleContent>
            <xs:extension base="xs:string">
                <xs:attribute type="xs:string" name="address" use="optional"/>
            </xs:extension>
        </xs:simpleContent>
    </xs:complexType>
    <xs:complexType name="serviceType">
        <xs:simpleContent>
            <xs:extension base="xs:string">
                <xs:attribute type="xs:string" name="name" use="optional"/>
            </xs:extension>
        </xs:simpleContent>
    </xs:complexType>
    <xs:complexType name="zoneType">
        <xs:sequence>
            <xs:element type="sourceType" name="source" maxOccurs="unbounded" minOccurs="0"/>
            <xs:element type="serviceType" name="service"/>
        </xs:sequence>
    </xs:complexType>
    <xs:complexType name="userType">
        <xs:sequence>
            <xs:element type="zoneType" name="zone" maxOccurs="unbounded" minOccurs="0"/>
        </xs:sequence>
    </xs:complexType>
</xs:schema>